Date,Hotel,Title,Review,Sentiment
10/8/2009,can_quebec_montreal_hotel_omni_mont_royal,Great location large rooms could use a rejuvenation.,"We stayed at the Omni for 4 nights. This hotel's greatest quality is it's location- plenty of excellent restaurants, shopping, and museums within walking distance. Try Chandelier for pizza- gorgeous inside and 2 for 1 gourmet pizzas while we were there. We stopped by a couple times! Easy walk to St. Catherine shopping. The hotel itself is not necessarily of the quality we've come to expect from domestic Omnis. The lobby is small, although welcoming. The rooms show their age, but are larger than you would expect. With a little facelift, this could be a great hotel. The service we'd received at other Omni locations was also lacking here. Usually the staff is falling over each other to make every attempt to make your stay enjoyable, well above average. The service at Mt. Royal was average, typical hotel quality. As an example, as part of their loyalty program, we received coupons for free pressings, but their pressing machine was out of order all 4 days of our visit. No attempt was made to find us an alternative. Overall, the location was excellent for a pedestrian, and if I were planning the same trip, I'd probably go back.",
10/8/2009,can_quebec_montreal_hotel_omni_mont_royal,Not a Five Star!,"I was very dissapointed with the Omni Mont Royal. I booked this hotel for a weekend getaway with a few of my friends (some of which stayed at other hotels nearly - which were cheaper and much more comfortable) and was very dissapointed when i got to the front counter and was advised we were given a room with 2 twin beds. I had booked 2 double beds (they said i had booked for 1 person only ) and was advised that due to many hotel guests changing their bookings last minute that all they had left were either 2 twin beds or 1 king bed. Even though we each got our own bed, i was definitely not impressed that a five star would even offer twin beds?! The comfort level of sleeping in a twin bed is nowhere near that of a double or even queen. I had read some of the reviews before i had gone and have to agree that the Omni needs a major facelift. The staff at the counter was very friendly as was the bellhop and valet. We had a great view of Montreal but that was about it. i would not recommend this hotel until they renovate it.",
9/19/2009,can_quebec_montreal_hotel_omni_mont_royal,Good Value - well located,"We stayed here for 2 days. The young girl who checked us in was very pleasant - though we have to say other receptionists were quite dismissive when we asked for change.Girl on conciege desk was very helpful as was the young man - though others were not and allowed people to skip ahead of me in the queue. One of the bellhops was topnotch in giving advice and even came into the lobby to help.The room was on the 24th floor and had great views over the city, it was clean and pleasant - I was a bit worried about other reviews of shabby rooms - but ours was nice if a little outdated . Linen could do with replacing though. The staff forgot to replace feather pillowa, but this was done quite promptly.The car parking was not great, with queues waiting to drop off luggage, you can park your own car without having to pay valet costs. Though we felt that some of the valet staff were keen to fetch our car and not too happy when we declined.Overall I would recommend the Omni for location and general good standard.",
9/12/2009,can_quebec_montreal_hotel_omni_mont_royal,Pleasant Hotel in a Great Location with some Minor Flaws,"I booked my ticket on Priceline for around $100/night which, for the location, is pretty good. The hotel staff were very friendly and courteous, though the entrance is a bit hectic and chaotic. There is a parking garage on the adjacent block which was a trick to find, but since Montreal has a good transit system we were able to leave the car there the entire weekend. The room was a bit aged but clean for the most part. It did smell a bit of smoke, so next time I will definitely ask for a non-smoking room. On the back of the bathroom door we found the previous guest's shorts and panties on the hook - apparently they had forgotten them and housekeeping missed them. The room and bathroom were clean though and that was the only flaw I could find. We were on the 29th floor and the view was wonderful. The bed was comfortable, the room decently sized, and the bathroom was quite nice overall. Plenty of hot water and water pressure. The location is only two blocks from the bustling St. Catherine Street.. and only one block from the nearest Metro station. It's also close to the Parc Mont Royal which offers spectacular views of Montreal and plenty of walking and hiking trails. It is also close to McGill University. For these reasons, I don't think you can get much better in terms of location. I did not try the restaurant or the bar in the hotel. I did use the gym, and it was actually quite large compared to other hotel gyms I've used. It had plenty of free weights, machines, and towels - I was very pleased. The pool was very nice and clean too, and neither were very busy when I used them. The gym was actually empty on one occasion.There was also free high-speed internet. Overall, I did enjoy my stay in the hotel. Despite some flaws, I would stay here again, as the price was reasonable and the service friendly. I would recommend this hotel to others, though I would definitely not pay more than what I paid for on Priceline.",
9/12/2009,can_quebec_montreal_hotel_omni_mont_royal,What a surprisingly delightful stay!,My wife and I just left the Omni Hotel in Montreal and were very sorry to have to leave. To say we were treated like we were family is an understatement. We were treated so well it was a shock! From the registration personal to the service employees we had a stellar experience. The staff knew the city well and gave us excellent advice both on directions to the sights and to incredible restaurants. The location of the hotel was central to all of the places we wanted to see and the metro was just a block away. We are travelers. We have been in many places all over the world. The Omni ranks at the top of our experiences. Thank you for such a pleasent time in your city!,
9/8/2009,can_quebec_montreal_hotel_omni_mont_royal,Good hotel in downtown Montreal,"We stayed on the 4th floor adjacent the elevator, which proved quite noisy throughout the night as people returned to their rooms.The room was of a decent size with good wardrobe/storage space, although would benefit from &quot;refreshing the decor&quot;. The hotels public areas seemed quite small but the service of the staff was excellent.Free internet service was good but valet parking $26.95 +tax and in-room water at $7 +tax were expensive. The hotel had a reasonably equipped gym, a hot tub and outside pool with sun loungers.",
8/23/2009,can_quebec_montreal_hotel_omni_mont_royal,Lovely time at the Omni,"This review is a from a trip to Montreal my husband and I took in 2006, when we lived in Toronto (we now live in Montreal).We had found a great deal for Montreal's Omni Hotel on Expedia - under 100$ - and one of my biggest concern was getting a run down room or lesser service because of it, as is sometimes the case when booking online with these types of web sites. Not at all! Upon our arrival the valet was courteous and friendly, immediately assisting us with our luggage, and waited for us as we checked-in. The young lady who checked us in was nothing more than gracious, and she even commented with a smile that we were appointed a beautiful room, with a great view of the city. She was right! The valet chatted us to our room, asking us where we were from, and being very generous by telling us to not hesitate to call him if we ever needed anything. He actually wrote down his name and his extension on a piece of paper! The room was just perfect and exactly what we needed.We stayed for two nights, room was perfectly cleaned on the 2nd day when we came back, and our check out went smoothly, although the staff was not as nice or friendly as the young lady who had welcomed us. In fact, I found the young man who checked us out to be rather cold (the type who machinely asks &quot;so how was your stay&quot; while looking at this screen and who doesn't really listen to your answer) but the rest of our stay was so wonderful that we didn't pay attention to this detail. Parking is very pricey, but that is to be expected, however I will add that the parking service was efficient and fast.We loved our stay and will most certainly try the Omni again, in Montreal or elsewhere.",
8/21/2009,can_quebec_montreal_hotel_omni_mont_royal,Wonderful hotel and decent rooms,My wife and I booked this hotel through priceline and were extremely happy with the rate we received. We were prepared for sub-par service as priceline customers but were met with incredible service over the phone and at check-in. As per some of the other reviews the rooms can use some updating but were still large and sufficient. With regards to Wifi as long as you sign up ahead of time as a Select Guest Member (you will start at Silver level) you can use your select guest member number to get on to the free wifi regardless of floor you are on. We were not charged for using wifi at the end of our stay. Overall the hotel and staff were excellent and we will definitely be recommending this hotel to our friends!,
8/18/2009,can_quebec_montreal_hotel_omni_mont_royal,Great Service will truly be 4 star once the rooms are updated,"My daughter and I stayed at this property for 5 days. We got an amazing rate for the stay. I read the reviews in advance and expected the need for updates in the rooms. The service was fantastic. From the moment we arrived we were well taken care of. Bernard at the valet is simply adorable. A great asset! Our bags were removed from the car without asking and they just appeared next to us upon check in. We used the concierge several times and each time they were helpful. The location is fantastic. If you are into fitness they have great facilities with plenty of equipment and you can walk up the hill to Mount Royal and get a great workout on the stairs there! There is plenty of shopping near by. The Art Museum is right down the road (and free!). Easy metro to Old Montreal where we spent a great deal of time. Yes the rooms need to be updated. But it was not gross in any way ( and I have standards). The lobby and common space was great. I don't know if it was just a slow period, but it was also very quiet. Which was fantastic! If you are a spa regular, I don't recommend the Amerispa. I was disappointed with their facilities and the girl who gave me my facial had obviously just eaten onions (eww) She also was the same person to do my pedicure. Not a good sign. She was adorable. But not good at her job.Stay here while you can. Once they renovate the prices will go back up to 4 star rates.",
8/17/2009,can_quebec_montreal_hotel_omni_mont_royal,Brilliant Stay,"Stayed here as part of my 23 day tour of New England and Canada. Everything about this hotel, apart from the cost of a bottle of water, was brilliant!Super staff, breakfast and location. This was my first stay in an Omni hotel and i will certainly be using other hotels in this group.",
11/25/2009,can_quebec_montreal_hyatt_regency_montreal,unexpected detour,"We had an unexpected detour. Montreal was not in our plans but it happens. The staff at the desk was awusume. Especially one, Ginette, she did far more that what any one expected. The hotel is on the metro and could not be better located. Thank you Ginette.",
11/21/2009,can_quebec_montreal_hyatt_regency_montreal,Deceptive,The remote battery was dead there was not sufficient wash cloths the bed wa squeekyThe service at the desk was rude and snoby The wireless is for a fee A good point were the employees at the garage friendly and helpfulI will not go back again it was very desapointing,
11/11/2009,can_quebec_montreal_hyatt_regency_montreal,Conveniently located in the heart of Montreal and great service.,The Hyatt Regency Montreal is located right in the centre of the city of Montreal. It is well connected to St. Catherine Street which is the main shopping street in Montreal which further connects one to 33 sq. kms of shopping area!The service is great and the room are spacious and comfortable.I highly recommend it to anybody visiting Montreal on business or for pleasure.,
11/10/2009,can_quebec_montreal_hyatt_regency_montreal,A NICE PLACE,"We arrived a couple of hours earlier than check in and were told that we could not check in till 3pm, which was check in time. This was an inconvenience as we had to travel the streets for 2 hours while all we wanted to do was lay down and sleep for a few hours.",
11/6/2009,can_quebec_montreal_hyatt_regency_montreal,Great hotel right downtown!,"Very nice hotel. A little confusing to find the lobby if you park in the Complexe Desjardins... but overall very nice room, great price and awesome view of &quot;Place des Arts&quot;.",
11/4/2009,can_quebec_montreal_hyatt_regency_montreal,Great Location--average hotel,"Stayed 3 nights at the Grand Regency at the end of Oct/beginning of Nov. I was there for a conference, and this was the conference hotel. The adjoining conference center is quite nice, and the hotel location is quite convenient to Old Montreal, a metro stop, etc.The hotel is a bit disappointing. My wife and I arrived the first night to discover that they didn't have a king-size bed for us after all (the reservation had guaranteed it). Instead, we were given a single double bed for the first night. After a question about this, they gave us a coupon for the breakfast buffet, but we would have rather had the promised room. Fortunately, they switched it the next day, but it took all day to do so, and they didn't move our baggage as they said they would.The breakfast and hotel bar seem outrageously priced for what you get. Both are OK in quality, but not great.Location/cleanliness: very good to excellent.I think you could find much better hotels for the price, especially if you aren't going there for a conference at that center.",
10/29/2009,can_quebec_montreal_hyatt_regency_montreal,Not one of the better Hyatts but nice enough,"Location wise, the Hyatt is front and center to Place des Arts, which is usually ground zero for the Jazz and Franco Folies festivals, which can be a good thing. Otherwise, it's location is just OK, but it is right on the Metro line. Both times I stayed there, I booked through third party booking sites. Perhaps accordingly, I had odd rooms. The shower head and tap were in a weird spot and there was no minibar, which is always annoying (I'd like to at least have the option of using it if I want to).",
10/27/2009,can_quebec_montreal_hyatt_regency_montreal,Perfect place in Montreal,Great location near Old Montreal and other popular areas like St. Catherine and St. Laurent Streets. Comfy and clean and often available on Priceline for a great price.,
10/15/2009,can_quebec_montreal_hyatt_regency_montreal,Perfect Fall Getaway,"I have been a patron of the city of Montreal for many years and have stayed in lots of hotels. However, I must tell you this hotel was fantastic in location, service and amenities! The rooms were clean and comfortable. The service at the front desk, bellman, valet, conceirge, etc. were superb. The pool area is excellent with beautiful sliding doors, giving access to a pavillion with street views. The only complaint which is really not a biggie was there was no bar service until 5:00pm?! Just wanted to have a couple cocktails but ended up headed out on St. Catherine Street and hangin in the outdoor cafes. I highly recommend this safe(parking underneath the hotel), friendly and chic hotel to anyone familiar or unfamiliar with Montreal. Please feel free to email me if you have any other questions. :)",
10/9/2009,can_quebec_montreal_hyatt_regency_montreal,Good location good front desk staff,"Stayed there by myself for a marathon and got the executive package, which allowed me access to the concierge suite with free apps and private concierge. The private concierge wasn't great, as he wasn't around untill 1pm, but the free appetizers was nice Good location and friendly frontdesk. no official concierge, so if you have to ask for reccommendation you have to wait in front desk line which could be annoying if they were busy. Very close to good shopping, perfect location.",
9/21/2009,can_quebec_montreal_hyatt_regency_montreal,Decent,"Upon arriving at the Hyatt Regency we were quite impressed with the beautiful foyer and elegant decore. We'd seen on the website that they offered a romance package and figuring we might as well make bussiness trip double as a romantic weekend away. When we inquired about the 'romance package&quot; there was no such thing to our dismay.After checking in we realised that a long wait at the elevators was due to only two out of the four elevators were functioning it took over twenty minutes to get past the major line up.When getting to our room it was simple, an obviously dated hotel that had been given a few modern touches. Nothing spectacular. Spacious bathroom with a narrow bathtub, no options to upgrade to a jacuzzi. the room was adequate with a 21 inch tv, and king size bed that was quite firm. The room was clean upon arrival, we sayed for three and out of three days our room was only cleaned once, cleaning which didn't inclde restocking our minibed or changing the towels, as they are only changed every three days to save on cost. When we callled down for clean glasses and fresh towels, we were put on hold for 10 minutes after which we waited another thirty minutes, after calling down for a third time we finally had enough and went down to get our own glasses.There state of the art gym was lacking in the weight area, but is good for cardio. The pool was beautiful and kept at an amazing warm temperature. the lounging area for the pool is beautiful with a terrific sunroom. Right in the downtown area there is tons of shopping options and cabbing is easily done, fabulous location.All in all we paid a 125$ for a night for three nights stay, fabulous location. the hotel is absolute basic, no luxuries. My girlfriend stayed one night at 198$, for the same type of room on the same floor and would not do it again.",
9/18/2009,can_quebec_montreal_hyatt_regency_montreal,Mixed Emotions...,"Although well situated in the city, this hotel is by no means perfect. If you get a good deal, though, go for it!Most noteworthy...SET UP - As you've probably read in other reviews, it's a bit of a pain in the neck to navigate this hotel, as you first have to take an elevator several floors to the lobby before then doing the same to get to your room. Unfortunately, the elevators are a bit schizophrenic. LOCATION - Right in the mix of things - a short walk here and a short walk there. Also situated above a mall (with a full grocery store!).FITNESS / RELAXATION - As part of an apparent renovation, they clearly paid attention to the addition of a decent workout room with ample equipment. Also, the pool and deck area were very enjoyable. Be sure to enjoy the sauna and steam area, too.ROOM - This is where things start to get a bit sad. Although recently renovated, it looked somewhat worked over - not bad by any means but certainly not what you might expect given a recent makeover.SERVICE - A spotty area as well. Check in was a bit of a mess with a line of people and a desk staff that seemed off their game - unable to deal well with the volume of people and a variety of issues. One evening, the hotel hosted a wedding reception with music that kept hotel guests awake until 2:00 AM. Staff/management was ill-equipped to deal with this sort of frustration from guests.",
9/2/2009,can_quebec_montreal_hyatt_regency_montreal,it will do,"location: it's a pretty far walk from old montreal, but it's walkable. with some connecting stops on the subway you can get to old montreal from the hotel to the champs-de-mars stop. the hotel is located about 2 blocks away from what i'd consider to be montreal's &quot;red light district.&quot; it is located on st. catherine street and if you walk a couple of blocks (5-6) towards dairy queen you start to hit some decent shopping.Eating: The diner, Eggspectations, is right down stairs, they make reallly good french toast! and the hotel is located right above the Complex des jardin's food court. the hotel has a restaurant, aswell, but it was under renovations while i was there.hotel: small rooms, dimly lit, basic amenities, small bathroom, not impressed. wouldn't stay again.",
8/26/2009,can_quebec_montreal_hyatt_regency_montreal,Great hotel!,"We stayed here 2 nights and it was a lovely hotel. We were asked if we'd like 2 double beds or a king bed, so we took the latter. The room was spacious and comfortable, though my partner had a stiff/sore neck from the pillows but I guess he could have brought his own. The staff are very helpful and will tell you where to go if you don't quite know, or how to get to where you do want to go (Maria was helpful and saved us a long walk because my partner was under the impression that it wasn't so far away but it was, and Olga recommended which streets to wander for some nice restaurants). The gentlemen at the parking are great too - very nice, courteous and willing to help out in any way that they can (regular parking is $19, but each time you take your car out you will have to pay again, so we went with valet parking, which is $26 a day).We were able to get internet, 2 hours for $5 (and there are various other options for other prices), but once we also took advantage of the Starbucks across the street, bought some coffees and used their wifi.Only complaint - the washroom. Very small but still, it was clean and everything (although not so much the tub) was quite nice.",
