Date,Hotel,Title,Review,Sentiment
8/26/2009,can_montreal_hyatt_regency_montreal,Great renovation of this nearly 35 year old hotel. . .,"This hotel started life as Le Meridien, and later had a Radisson flag on it, before the most recent renovation that sees the property managed by Hyatt. In the years since its opening just before the Olympics, its Complexe Desjardins location, across from Place des Arts, hasn't changed, but Montreal has gotten more interesting going eastward, so the hotel is more central than ever. . .Kudos to the owners and designers who carried out this renovation. Given the age of the hotel--a lot of Montreal was erected in the mid 60s to mid 70s, for the Expo 67 and 1976 Olympics, and not all has aged gracefully--the refurbishment was a near gut rehab. And a thorough one at that. . .new and fresh lobby, guest rooms, lounge areas, and fitness center.Rooms are not huge, but they are ample and airy. The original design of the building, sort of a checkerboard pattern, provides just half a window to the outside. Supposedly, the view I received, out over Place des Arts and a slice of Mount Royal, is a premium one with a surcharge--the front desk agent gave it to me as 1) I requested it, and 2) she was not sold out. Very nice of her, but the view would not be worth the $20 per night extra cost. Great Hyatt beds, in-room coffee, and brand new carpet are highlights. Odd that they did not install flat screen TVs given the newness of the reno effort. Bathrooms are well laidout, and more pleasant than their size would indicate. Great bumpy Portico soap and curved shower rods are nice touches, though the vanity has just one sink, and a small area at that.Interestingly, Priceline categorizes this hotel as a 3 1/2 star, while its freshness and amenities would be closer to 4 star in my book (especially given some of what Priceline does call 4 star). That rating accounts, in part, for the $63 US room rate bid that Priceline accepted--a steal for this hotel. It is to the hotel's credit that I was treated with VIP service, and upgraded even with this--some hotels treat you like the great unwashed if you are a Priceline purchaser.The hotel lobby is seven stories above the street, and the double elevator rides get a bit tedious--the trip to your room requires an elevator to the lobby, then a second set of elevators to get you through the guest room tower.The Complexe Desjardins/Place des Arts location puts guests within underground access to two Metro stations (with similar names, Place des Arts, and Place d'Armes), the Convention Center, and much of the rest of downtown Montreal's vast tunnel system. Complexe Desjardins, itself, is a large mall and office complex (the center court is one of the most voluminous retail spaces in the world. .) with a considerable food court at the lower level. Place des Arts, right across St. Catherine St. is Montreal's answer to Lincoln Center, with a number of performance spaces, and the hall for the Montreal Symphony. Chinatown is nearby, and the main downtown shopping stretch along St. Catherine is just a few blocks to the west of the hotel. St. Catherine going east, from about St. Urbain to St. Denis, is the closest thing downtown Montreal has to a red light district, and while it is not aggressively awful, it is not pretty, particularly at night. The gay Village starts just beyond St. Denis, about a 15 minute walk east. And north along St. Denis is the Quartier Latin, with countless cafes and restaurants spilling out onto the sidewalk. Visitors who take the train into Central Station have about a six block walk.Overall the Hyatt can be a great choice, particularly when Priceline bids in the $60-70 range are accepted. Even at full price, the location and stylish renovation make this a strong hotel to consider for a Montreal visit.Good things:Complete renovation of a 34 year old hotel—stylish and comfortable update.Notably central location—within Complexe Desjardins for shopping and dining options, across from Place des Arts, and connected to underground city/convention center—covered access to two Metro stations.Brand new fitness facility and pool area, with sun deck, fitness center use freeGreat beds, new carpet, and numerous outlets—nice Portico bath products, and curved shower rods.Solid service—upgrade at front desk despite Priceline booking, waived two local calls’ charge, responsive housekeeping staff.Free in-cup coffee maker (though include paper cups—mugs only doesn’t cut it)Refrigerator, not mini bar, in room.Not good things:Not in the center of downtown—five blocks from core.Neighborhood just to east of the hotel along St. Laurent kind of sketchy.Double elevator—ground floor to lobby, then lobby to guest room tower—makes for longer time to room. As well, frequent elevator stops.Despite recent renovation, retained old style televisions.Charge for internet in rooms.",
8/18/2009,can_montreal_hyatt_regency_montreal,WiFi not included,"I know its a minor thing, but the website suggested it was in the room. Like the towels and electricity we assumed it was included. It was not and forced us to use free services elsewhere. The TV was also an extra fee. The sink was plugged whenever we used it. And needless to say we spent as little time here as possible. Good points. The room was clean, the beds were made every morning and aside from listening to the FrancoFollies every night it was fairly peaceful on the 11th or so floor.",
8/18/2009,can_montreal_hyatt_regency_montreal,Clean comfortable good location... but not worth 4 stars,"I booked this hotel on Hotwire for about $96 USD/night. I wouldn't pay much more than that however.Good... clean, great downtown location, comfortable beds, friendly staff.Bad... it's not 4 star as advertised. 3.5 sure. The rooms and bathrooms need a little updating. Hotel movie had background &quot;static&quot;. Not great when you pay $12.99 for one.The real bad... the air conditioning. It was really warm in Montreal (above 30 degrees). The AC in the rooms couldn't keep up . While we had it on max, it was about 24 degrees in the room. They first came up... said it was broke... they'd send a repair person the next morning and if that didn't work, they'd change us to another two double room. And they sent a fan up. Next morning... nothing. We left for the day. Came back... called again... said they would call back in a few. No call. Third time he said he'd check into it. Nothing. Friendly but not very organized.Talking to other guests... we're thinking it wasn't broke and it just sucked to begin with.",
8/18/2009,can_montreal_hyatt_regency_montreal,Nice Stay Great Pool,"I stayed for 3 nights from August 8th to August 11th with my wife, 13 year old daughter and 8 year old daughter. The check-in was easy and the staff were very friendly and helpful. We found the Hyatt to be reasonably priced and and wonderfully situated. You can walk to all the downtown attractions and Old Montreal. The subway is directly under the hotel and can take you anywhere you want to go. There are many coffee shops with excellent muffins and pastries in the food court in the mall underneath the Hyatt which is only an elevator ride away and very convenient when you are traveling with children. The indoor pool was wonderful. When they opened all the glass doors around the pool we got a beautiful view of the city from the pool area. As one reviewer stated, there could have been more chairs around the pool but if that's going to ruin your vacation then stay home. I would highly recommend this hotel to friends and family.",
8/15/2009,can_montreal_hyatt_regency_montreal,definitly not a 4 star hotel,Not as good as the other Hyatts. Check in took forever. Valet parking was very slow. Rooms were clean but the bathroom had mold.,
8/15/2009,can_montreal_hyatt_regency_montreal,Worth it on sale.... otherwise?,"This hotel does not meet the Hyatt standards. While the staff is nice, and the location is great, the hotel is run down. The common spaces and rooms are nicely furnished, but for a hotel that is supposed to be four star, it's not. Rooms need money spent to update them (i.e. flat screen t.v.s) It's difficult to get into the hotel (one elevator to the lobby, and then one to the rooms), but it's location makes it worth $100 a night, not much more. Having stayed at another Hyatt property this week, I was disappointed with this one.",
10/22/2009,can_montreal_le_square_phillips_hotel_suites,great location in addition to a charming little italian restaurant,"this really made our trip pleasurable and comfortable! the hotel's cleanliness and spacious rooms, in addition to the very professional staff, are only outshone by the good location in downtown Montreal as well as the lovely Italian restaurant where we took our lunch and cappucino. great value for money.",
10/20/2009,can_montreal_le_square_phillips_hotel_suites,Best hotel of our entire trip,"We stayed in Montreal for 2 nights as part of a 5 week Canada and USA trip. This hotel was a highlight - well located within easy walking distance of the train station and the main shopping strip, yet in a quiet and safe neighbourhood. The room was huge, with a full kitchen/dishwasher and dining table, and the king sized bed was amazingly comfortable. The hotel has a guest laundry and indoor pool on the top floor, and a no charge business centre for internet/computer access. Everything that a traveller needs. Reception staff were efficient and professional and there was no issue with us conversing in English. The only suggestion that I would make to the hotel is to improve the information contained within the guest services directory - there was no mention of the guest laundry, which we found quite by accident as we were exploring the pool area.",
10/9/2009,can_montreal_le_square_phillips_hotel_suites,We were very pleased!,"We spent 3 nights at Le Square Phillips and were very pleased with our choice. We booked a standard king suite through hotels.com for approximately $150/night. Given the location in a major metropolitan city, we felt we received an excellent value. As others have written, the rooms are huge. Spacious living area with very tall ceilings, a table with 4 chairs, a fully functional kitchen with full-size refrigerator and oven. The bathroom was adequate if on the older side. The bed was fine but firm, which we like but beware if firm mattresses don't agree with you. The bedding could have been of higher quality (you could nearly see through the sheets). Quiet stay and no issues with maid service.The hotel provides a complimentary breakfast which is on par with most complimentary hotel breakfasts. Plenty of cereal and pastry selections, fruit, yogurt, juice &amp; coffee.We loved the size of the room and the location in Montreal. We walked everywhere or took the Metro. Would definitely stay here again if we return.",
10/8/2009,can_montreal_le_square_phillips_hotel_suites,Rare combo of chic and friendly,"We chose this hotel based on other tripadvisor reviews, and we're glad we did. It was a rare combo of chic and friendly. My husband and I loved the urban vibe, and the kids loved the room, the pool, and the breakfast. The hotel is well located, with friendly and helpful staff. A few caveats for families with young kids, though. The pool is 4m deep from end to end - too deep for kids to stand. Great looking flat screen tvs in rooms had limited kid-friendly channels, especially in English. Minor points, really, in an otherwise great stay.",
10/8/2009,can_montreal_le_square_phillips_hotel_suites,Excellent Hotel!,"Le Square Phillips is an excellent hotel. The location is ideal; it is centrally located and near several Metro stops. Our room was great; the kitchen was well-equipped, the view was nice, and the unique architecture of building really stood out in the room design. I would recommend the hotel to families and couples alike. The free internet access on hotel computers and breakfast were added bonuses that a lot of up-scale hotels don't include in their offers.",
10/4/2009,can_montreal_le_square_phillips_hotel_suites,Great location,"Stayed for 5 nights in a double studio room. Hotel is just minutes from busy Rue Catherine but very quiet. Additionally, the hotel is also a short walk to Chinatown, Old Montreal and Metro lines. The room was just as the picture showed on their web page and had a spacious area where the dining table/kitchen was located. The bathroom was large and very clean.The continental breakfast options (included in the hotel rate) were okay but we chose to buy a selection of items at the markets (see my reviews of the Jean Talon and Atwater markets) on a couple of the days instead of the hotel provided breakfast. Would definitely stay here again.",
9/24/2009,can_montreal_le_square_phillips_hotel_suites,Nice Hotel,"Located downtown, about a 20 minute walk to Old Town but close to many other attractions this is a smaller hotel with really big, comfortable rooms. Valet parking is $20 a day. Staff was cordial and helpful. Continental breakfast was included but that is my only minor complaint. Very basic, Motel 6-type spread.",
9/8/2009,can_montreal_le_square_phillips_hotel_suites,great deal on a conveniently located hotel friendly staff clean pack n play crib,"We stayed here on a 5-day vacation in August 2009. Had a nice problem-free stay in a large room (for no particular reason, we were upgraded to a larger suite than we booked). Fully equipped kitchen was nice- housekeeping did our dishes even though I think that was our responsibility. Room was nice and spacious but not fancy. Plenty of closet space. Clean Pack N Play crib was available for our one-year-old (although no one brought sheets). Hotel was quiet, staff were extremely friendly and helpful with suggestions for restaurants, etc. Pizza place Il Focolaio a couple doors down was really good and had outdoor seating. French restaurant a block away Restaurant Julien was good but pricier. Rooftop pool and deck were small but nice to have. Valet parking was $20 per day. Free internet worked fine (have to ask for a password at the front desk). Free breakfast included the usual fare- sometimes we skipped it. Would stay here again.",
9/8/2009,can_montreal_le_square_phillips_hotel_suites,Large and comfortable bed,"A great hotel: large and comfortable bed, large and quiet room, very convenient location.",
9/3/2009,can_montreal_le_square_phillips_hotel_suites,worst hotel experience in 10 years,"most overrated hotel. made a reservation based on trip advisor rating bnut TA way off on this one. arrogant check in staff, cold impersonal room, internet connection terrible, coffee and breakfast must be avoided. Room was large but so what. i had to empty the dishwasher when i checked in to get a cup for coffee. The gym is useless. Montreal is a great city. this hotel is like a plain vanilla hotel in any city. no feeling at all that one is in such a great city.I would never stay here again. do yourself a favor and find another hotel to stay in Montreal",
9/1/2009,can_montreal_le_square_phillips_hotel_suites,Largest room ever,"Our Junior Suite 411 at the Square Phillips was the largest room I ever have experienced in my 25+ years of travelling around the globe. I took 19 large steps from the kitchen end to the window end and almost 6 steps the narrow side, This included bedroom, living room and kitchen. Partitions separated them somewhat. Additionally comes a long isle opening to a medium sized bathroom with missing decor and a walk in closet. Overall easily more than 100 square meters. Amazing! Obviously they had some space left when transforming the office building into a hotel. Location was good, though you needed ground transportation to go to the trendy latin quarter. Staff was helpful and friendly. The hotel was quiet though we had some loud neighbors baging doors Sunday early morning.Just one question: Who needs 2 oversized flat screen TVs in listening distance? WiFi worked fine.",
8/28/2009,can_montreal_le_square_phillips_hotel_suites,Good Value,"Stayed here for two nights on a Friday and Saturday in late August as part of a trip to Montreal &amp; Quebec City. Great Value. Good location, easy-in easy out with Valet Parking. Its within walking distance of shopping old Montreal &amp; Chinatown (although a bit far for the later two).We had a large roon with a full kitchen complete with refrigerator, microwave, table plates and utensils. Breakfast was included but is limited but adequate(cereal, bagels, peanut butter, bread, muffins and fruit).Would certainly recommned for families and for longer satys.",
8/27/2009,can_montreal_le_square_phillips_hotel_suites,Ideal location but not perfect,"The location in downtown Montreal cannot be beaten - ideal for shopping, cultural activities, visits to museums and old Montreal. The rooms are certainly large with confortable beds, although the decor and bathrooms appear somewhat dated. Free internet access if provided to those with their own computer - otherwise at the business centre on the first floor. Breakfast is served until 0930 and the breakfast room gets overcrowded with families vying for tables and squeezing past each other to get to the food - which is basic fare. Check in staff were OK but did not bother to explain the hotel's facilities. The biggest pain was the housekeeping staff - they will even enter the room while you are at breakfast and before you are even ready for the day ahead, or they will call you on the phone to ask when you are leaving. However, their activities did not seem to stretch to changing the bed linen - during a week long stay, this did not happen once.",
8/26/2009,can_montreal_le_square_phillips_hotel_suites,Wonderful location and lots nearby,"I stayed for three nights and it was wonderful! Check in was quick and the staff friendly. Concierge answered my questions and mapped out where/how to get to places. Valet parking was easy. Location is great. You are 1 1/2 blocks from Ste Catherine's Street which is very active with lots of restaurants, shops, and people. I felt fine to walk around alone. You are also within blocks of many churches and museums. Leave your car with the valet and use subway and buses. The system was easy to get around. Breakfast at the hotel was fine...mostly breads, fruit, cereal and juice...enough for me. My room was quite large and when I asked apparently I had a smaller room. It had 2 beds, a full kitchen and a large bathroom. Very clean. I would definitely plan to stay there again.",
8/24/2009,can_montreal_le_square_phillips_hotel_suites,Great for teens,Great location. Big rooms which our two teenagers liked. Excellent service and very secure. Two Internet terminals in business centre at lobby level. Breakfast could be better if there were more choices. Small gym and beautiful swimming pool on top level. Also a nice deck on roof. Central to downtown Montreal. Beds are very firm but we were ok with them. Would definitely go back.,
8/24/2009,can_montreal_le_square_phillips_hotel_suites,Great set up all-around,We spent four nights in a two bedroom suite - incredibly spacious. The hotel is very centrally located so you can walk in many different directions. The included breakfast is very simple but it is quick and easy and filling. It is very nice not to have to look for another restaurant for a meal.The pool is small but very nice with a nice roof-top deck.The hotel is very quiet. I was always surprised at how many people were in the breakfast room given that we didn't hear or see them at any other time of day.We will definitely go back to this hotel,
8/23/2009,can_montreal_le_square_phillips_hotel_suites,Lovely---Perfect for our little family.,"Most have already covered what we would say. It would be nice to see a bit more variety in the breakfast, but that is our only small quibble. It is so comfortable, and the service was fabulous--they were lovely and classy, and not at all pretentious. The pizza place a few doors down had good thin-crust pizza--you can take it back to your room or eat on the patio area there, so it's really convenient. The hotel downstairs was nice, but a bit pricier/nicer than necessary for a family with an impatient small child. They were very accommodating, but it was kinda wasted on her 4-year-old sensibilities.",
8/22/2009,can_montreal_le_square_phillips_hotel_suites,Best hotel on the planet,"HUGE, HUGE room with FULL FRIDGE, MicroWave, 4-burner stove and *EVERYTHING*, very reasonable prices (for Montreal), totally awesome staff!They are large enuf to be very professional,andThey are SMALL enuf to be very PERSONAL, and to remember you, your car, etc. etc.Great view from the 11th floor pool balcony!Very close to underground shopping, ... everything you could want is in walking distance4 blocks to IGA, 5 blocks to Palace de Congress ... 1 or 2 or 3 blocks to *AWESOME* food ... Easy walk to &quot;Old Town&quot; where the hotel prices are 1.5x to 2x more.Parking is *INDOOR* and the Valet/Concierge is *VERY* *FAST*!!",
8/18/2009,can_montreal_le_square_phillips_hotel_suites,Excellent service and amenities,"I stayed at the Square Philips for four nights at the end of July 2009. We booked junior suite. This hotel does live up with the standard described on tripavisor. service was excellent as we checked in, one the receptionist who was on its way to leave work came back checked us in. The attention was really apreciated. the rooms are nice, very quiet with a decent bathroom, good choice of TV channels. Concerige and other staffs were truly helpfull during our stay. On the less postive side is the breakfast which is not worth the trip in my opnion, although is free. But all in all, this hotel has allowed us a very enjoyable time in Montreal.",
8/12/2009,can_montreal_le_square_phillips_hotel_suites,Perfect for our purposes,"My husband and I traveled to Montreal for our anniversary and wanted to be in a fairly central location with access to public transportation. We found the Le Square Phillips to be excellent for our purposes. We also enjoyed our late afternoon time on the rooftop deck to relax with some wine. The rooms were spacious and clean with a kitchen. The breakfasts were adequate. Although we weren't able to get much direction from the concierge, we had done homework before hand so it wasn't a big deal. If you are looking for extreme luxury, the Le Square Phillips is probably not for you. However, if you are looking for comfortable, centrally located with access to public transportation, and an inviting spot to watch the city go by, this is the place. We would definitely stay again.",
11/25/2009,can_montreal_sheraton_le_centre_montreal_hotel,Great hotel and location!,"As a Starwood Preferred Guest Gold Member, no upgrade was available at check-in. However, I was provided with complimentary access to the Club Lounge. Upon entering the lounge, when I gave my hotel room number, the attendant called the front desk and was advised I was not eligible. This was rather embarrassing!",
11/23/2009,can_montreal_sheraton_le_centre_montreal_hotel,Great location - sloppy maintenance ,"This hotel is in a great location, very central to everything. My room had an amazing view of the mountain, and the bed was very comfortable. However, the room, despite apparently being recently updated, looked tired. Weird decor &amp; color combinations, and the carpet felt nasty (rough) underfoot, as well as being ugly. If this is a renovation, they should get their money back. No mini-fridge in the room. Housekeeping was sloppy and erratic - one day, wet towels were left on the side of the tub. Another day, a towel and a dust rag were left in the room. My ice bucket (full of melted ice in the morning) was not emptied out on two days. Sometimes I got new tea bags, other days I didn't get new tea bags. Someone else's room service cart with leftover food was left sitting outside my room for most of a day. The pop machine on my floor was out of order the day I arrived, and it had not been fixed when I left, 7 days later..... The front desk folks were very helpful and friendly, but I was not impressed with the overall maintenance and housekeeping. Food at this hotel was generally good, but one day they served Montreal bagels for our conference - they were yesterday's bagels and they were stale/hard. The local Montreal folks were mortified. Considering how much everything cost at this hotel, you would think they could get fresh bagels that morning. The meeting rooms were nice - it was a good hotel for this conference, but I would not likely stay here if it wasn't the conference hotel.",
